{
  "pack": "health-claims",
  "version": 3,
  "generated": "2026-10-22",
  "rating_scale": [
    "supported",
    "extrapolated beyond evidence",
    "unsupported"
  ],
  "policy": "Neutral wording; claims assessed, not people. Exact quotes only where wording verified from transcript.",
  "claims": [
    {
      "id": "hc01",
      "person": "Andrew Huberman",
      "topic": "caffeine",
      "claim": "\"I'll sort of delay caffeine by a little while, usually 90 minutes to two hours.\"",
      "wording_status": "verified quote \u2014 Huberman Lab, 'Dr. Matt Walker: The Science & Practice of Perfecting Your Sleep', chapter 'Caffeine' starting 00:49:20",
      "claim_sources": [
        "hl-walker"
      ],
      "research": [
        {
          "text": "A 2024 evidence review found no basis in cortisol or adenosine physiology for the claim that delaying morning caffeine prevents an afternoon crash.",
          "sources": [
            "caff-review"
          ],
          "type": "evidence"
        }
      ],
      "rating": "unsupported",
      "reasoning": "Mechanism proposed is not demonstrated; no trial tests the delay."
    },
    {
      "id": "hc02",
      "person": "Andrew Huberman",
      "topic": "cold exposure",
      "claim": "\"The subjects also experienced a 250% increase in dopamine concentrations, which, while not 530% as it was with norepinephrine, is still a very large increase in baseline levels of dopamine.\"",
      "wording_status": "verified quote \u2014 Huberman Lab, 'Using Deliberate Cold Exposure for Health and Performance' (2022), chapter 'Cold Exposure for Dopamine, Mood & Focus' starting 01:00:22",
      "claim_sources": [
        "hl-cold"
      ],
      "research": [
        {
          "text": "\u0160r\u00e1mek et al. (n=10) measured ~250% plasma dopamine rise after 1 h immersion at 14 \u00b0C; plasma dopamine does not cross the blood\u2013brain barrier.",
          "sources": [
            "sramek-2000",
            "claimgrade-cold"
          ],
          "type": "evidence"
        }
      ],
      "rating": "extrapolated beyond evidence",
      "reasoning": "The figure matches the study, but it was plasma dopamine after 1 h at 14 \u00b0C; applying it to brain dopamine, mood or brief plunges is untested."
    },
    {
      "id": "hc03",
      "person": "Andrew Huberman",
      "topic": "cold exposure",
      "claim": "Cold-induced dopamine increase is comparable to cocaine.",
      "wording_status": "paraphrase, unverified wording",
      "claim_sources": [
        "magellan-hub"
      ],
      "research": [
        {
          "text": "The comparison links a human plasma study to a 1989 rat brain microdialysis study; measures are not comparable.",
          "sources": [
            "magellan-hub",
            "sramek-2000"
          ],
          "type": "evidence"
        }
      ],
      "rating": "unsupported",
      "reasoning": "Cross-species, cross-compartment comparison."
    },
    {
      "id": "hc04",
      "person": "Andrew Huberman",
      "topic": "cold exposure",
      "claim": "\"If your main goal is hypertrophy and strength, it is probably best to avoid cold-water immersion and ice-bath immersion in the four hours immediately following that strength and/or hypertrophy training.\"",
      "wording_status": "verified quote \u2014 Huberman Lab cold-exposure episode, chapter 'Cold, Physical Performance, Inflammation' starting 01:36:22",
      "claim_sources": [
        "hl-cold"
      ],
      "research": [
        {
          "text": "An RCT found post-exercise cold water immersion attenuated long-term gains in muscle mass and strength and acute anabolic signalling.",
          "sources": [
            "roberts-2015"
          ],
          "type": "evidence"
        }
      ],
      "rating": "supported",
      "reasoning": "Direct RCT evidence."
    },
    {
      "id": "hc05",
      "person": "Andrew Huberman",
      "topic": "light",
      "claim": "\"Aim for at least 10-15 minutes of sunlight right after waking, especially if you're waking before sunrise.\"",
      "wording_status": "verified wording \u2014 written protocol text on the Huberman Lab episode page (Matt Walker episode); not a spoken quote, no timestamp",
      "claim_sources": [
        "hl-walker"
      ],
      "research": [
        {
          "text": "Bright light pulses shift human circadian phase in a time-dependent manner (phase response curve).",
          "sources": [
            "khalsa-2003"
          ],
          "type": "evidence"
        },
        {
          "text": "Transition to bright light in the morning acutely raises cortisol.",
          "sources": [
            "leproult-2001"
          ],
          "type": "evidence"
        }
      ],
      "rating": "supported",
      "reasoning": "Core circadian physiology; specific durations recommended are extrapolations."
    },
    {
      "id": "hc06",
      "person": "Andrew Huberman",
      "topic": "light",
      "claim": "Evening light from screens delays sleep and circadian timing.",
      "wording_status": "paraphrase, unverified wording",
      "claim_sources": [
        "hl-light"
      ],
      "research": [
        {
          "text": "Reading on light-emitting eReaders before bed delayed melatonin and sleep onset vs printed books.",
          "sources": [
            "chang-2015"
          ],
          "type": "evidence"
        }
      ],
      "rating": "supported",
      "reasoning": "Small RCT; effect sizes modest."
    },
    {
      "id": "hc07",
      "person": "Andrew Huberman",
      "topic": "light",
      "claim": "\"There certainly is a place for blue blockers in the evening and nighttime if you're having issues with falling and staying asleep.\"",
      "wording_status": "verified quote \u2014 Huberman Lab, 'Using Light...' episode, chapter 'Tools: Sunlight (UVB), Blue-Light Blockers, Seasonal Affective Disorder' starting 01:12:48",
      "claim_sources": [
        "hl-light"
      ],
      "research": [
        {
          "text": "Cochrane review: blue-light filtering spectacle lenses may not reduce visual fatigue; effects on sleep quality are uncertain (low-certainty evidence).",
          "sources": [
            "blue-light"
          ],
          "type": "evidence"
        }
      ],
      "rating": "extrapolated beyond evidence",
      "reasoning": "Cochrane finds sleep effects of blue-filtering lenses uncertain; a conditional, evening-only suggestion goes beyond the evidence but isn't contradicted."
    },
    {
      "id": "hc08",
      "person": "Andrew Huberman",
      "topic": "alcohol",
      "claim": "There is no safe level of alcohol consumption for health.",
      "wording_status": "paraphrase, unverified wording",
      "claim_sources": [
        "hl-alcohol"
      ],
      "research": [
        {
          "text": "WHO Europe states no level of alcohol consumption is safe for health.",
          "sources": [
            "who-alcohol"
          ],
          "type": "evidence"
        },
        {
          "text": "GBD 2016 modelling concluded the level minimising health loss is zero.",
          "sources": [
            "gbd-2018"
          ],
          "type": "evidence"
        }
      ],
      "rating": "supported",
      "reasoning": "Consistent with WHO and GBD; some debate on low-dose estimates."
    },
    {
      "id": "hc09",
      "person": "Andrew Huberman",
      "topic": "supplements",
      "claim": "Tongkat ali can raise testosterone.",
      "wording_status": "paraphrase, unverified wording \u2014 topic discussed in Huberman Lab testosterone episode, chapter 'Free and Bound Testosterone: SHBG, Tongkat Ali' starting 01:40:14 (exact claim wording not found)",
      "claim_sources": [
        "hl-tongkat"
      ],
      "research": [
        {
          "text": "A meta-analysis of small trials found Eurycoma longifolia increased total testosterone, mostly in hypogonadal men; studies were of limited quality.",
          "sources": [
            "tongkat-ma"
          ],
          "type": "evidence"
        }
      ],
      "rating": "extrapolated beyond evidence",
      "reasoning": "Some human data but small, heterogeneous, population-specific."
    },
    {
      "id": "hc10",
      "person": "Andrew Huberman",
      "topic": "supplements",
      "claim": "Fadogia agrestis can raise testosterone.",
      "wording_status": "paraphrase, unverified wording \u2014 Fadogia agrestis is listed in the same episode's chapter list ('Optimizing Brain Hormones: Chorionic Gonadotropin, Fadogia Agrestis'); exact claim wording not found",
      "claim_sources": [
        "hl-tongkat"
      ],
      "research": [
        {
          "text": "Evidence comes from rat studies; one rat study also reported testicular toxicity signals.",
          "sources": [
            "fadogia-rat"
          ],
          "type": "evidence"
        }
      ],
      "rating": "unsupported",
      "reasoning": "No human trials located."
    },
    {
      "id": "hc11",
      "person": "Andrew Huberman",
      "topic": "NSDR",
      "claim": "Yoga nidra/NSDR increases striatal dopamine.",
      "wording_status": "paraphrase, unverified wording \u2014 ATTRIBUTION GAP: no episode located yet",
      "claim_sources": [],
      "research": [
        {
          "text": "A PET study of 8 experienced meditation teachers found increased endogenous dopamine release (reduced raclopride binding) during yoga nidra.",
          "sources": [
            "hl-nsdr"
          ],
          "type": "evidence"
        }
      ],
      "rating": "extrapolated beyond evidence",
      "reasoning": "Tiny sample of experts; generalisation to protocols is untested."
    },
    {
      "id": "hc12",
      "person": "Andrew Huberman",
      "topic": "ashwagandha",
      "claim": "Ashwagandha reduces stress/cortisol.",
      "wording_status": "paraphrase, unverified wording \u2014 ATTRIBUTION GAP: no episode located yet",